title,Departments,keywords
"Life's Tough, Wear a Helmet: the Lasting Effects of Multiple Concussions in College Athletes",Neuroscience,"concussions, cummulative effects, nueropsychological tests, electrophysiological tests"
The Effects of Curcumin on a C57Bl/6J Mouse Model of Thiamine Deficiency Induced Wernicke-Korsakoff Syndrome,Neuroscience,"curcumin, wernicke-korsakoff syndrome, c57bl/6j mice"
Divergent Effects of Prolonged Progesterone Exposure on Depressive-Like Symptoms and the Expression of Myelin Basic Protein in the Corpus Callosum of Adolescent Female Rats,Neuroscience,"depression, major depressive disorder/ MDD, forced swim test/ FST, behavioral despair, white matter, myelin, myelin basic protein/ MBP, enzyme-linked immunosorbent assay/ ELISA, corpus callosum, menstrual cycle, ovarian hormones, progesterone/ P4, female rats"
Patterns of Executive Function in Down Syndrome,Neuroscience,"down syndrome, alzheimer's disease, executive function, hot executive function, cool executive function, aging, cognitive decline"
An Investigation of the Effects of Estrogen on Anxiety and Hippocampal-Dependent Fear Conditioning,Neuroscience,effects of estrogen on anxiety and fear behavior
Lower Leg Compression Shows Promise to Improve Prolonged Peroneus Longus Reaction Time in Individuals With Functional Ankle Instability,Neuroscience,functional ankle instability
Looming Bias and Implicit Association: Is Racial Bias Implicit or  Learned by Social Upbringing?,Neuroscience,"implicit racial bias, looming bias, social contact, face"
Identification and Functional Analysis of Voltage Dependent Calcium Channels in   Paramecium Tetraurelia,Neuroscience,"ion channel evolution, ion channel evoution, paramecium"
Ketamine’s Prolonged Anti-Depressant Effects in Two Models of Rat Depression,Neuroscience,"Ketamine, antidepressant, anti, depressant, anti-depressant, Prolonged, extended, models, rat, rodent, depression, depressive"
"The Effects of Prenatal Exposure to Bisphenol A (BPA) in combination with Prenatal Stress on Learning, Memory, and Anxiety in Rats",Neuroscience,"Neuroscience, Biology, Bisphenol A, Prenatal Stress"
Protective Effects of Nicotine on Ethanol-Induced Toxicity on SH-SY5Y Cells,Neuroscience,"nicotine, neuroprotective, ethanol, toxicity"
"Nootropic Drug, Noopept, in a Rodent Model Concerning Morris Water Maze Latency and TrkB Full-Length Gene Downregulation",Neuroscience,"Noopept, TrkB, BDNF, Morris water maze, qualitative real-time PCR, rats"
"Nootropic Drug, Noopept, in a Rodent Model Concerning Morris Water Maze Latency and TrkB Full-Length Gene Downregulation",Neuroscience,"Noopept, TrkB, BDNF, Morris Water Maze, Qualitative Real-Time PCR, Rats"
Sex-Specific Differences with Omega-3 Fatty Acid Supplementation in an Adult Animal Model of ADHD: Omega-3 PUFAs in Adult ADHD,Neuroscience,"omega-3 PUFAs, activity levels, adult ADHD, sex differences, SHR-SP"
Effects of Dietary Omega-3 Supplementation During Early Development on Learning and Memory in Adulthood in a Rat Model,Neuroscience,"omega-3. fatty acids, learning and memory"
Regulation of Retinal Neuron Pathfinding in Drosophila melanogaster by Evolutionary Conserved Poly (a) Binding Proteins Implicated in Intellectual Disability,Neuroscience,RETINAL NEURON PATHFINDING POLY (A) BINDING PROTEINS INTELLECTUAL DISABILITY
Personality Factors Underlying Risk Propensity in Individuals with a History of Substance Abuse,Neuroscience,"Risk Propensity, Personality, Substance Abuse"
The Impact of Rumination and Mindfulness on Attentional Control and Depression,Neuroscience,"rumination, mindfulness, attentional control, internet browsing habits, depression"
Distinguishing Between the Influence of Gonadal Hormones and Sex Chromosomes on Sexual Dimorphisms in the Cortex Through Use of the Four Core Genotypes Model,Neuroscience,"sex differences, cortical thickness, four core genotypes model"
Female Sex Hormones and Their Influence on Athletic Performance and Perception of Auditory Looming Sounds,Neuroscience,"sex hormones, athletic performance, perception of auditory looming sounds"
An Investigation on the Effect of Long-term and Short-term Lisdexamfetamine Dimesylate and Acute Exercise Treatment on Spatial Learning and Memory and Anxiety Levels in Adolescent Rats,Neuroscience,"Stimulants, Learning and Memory, Anxiety levels, ADHD"
An Exploration of the Neuroprotective Properties of Omega-3 Fatty Acids In a Learning Deficient Mild TBI Model,Neuroscience,"TBI, Omega-3 Fatty acid, Scopolamine"
The Influence of Intergroup Contact on Implicit Attitudes: A Study of the Other-Race Effect,Neuroscience,"the other-race effect, race, face processing"
Cognitive Differences as a Result of Concussion in Males and Females,Neuroscience,"traumatic brain injury, EEG, sex differences, behavior, ERP"
"Assessment of the Neuroprotective Efficacy of NGP1-01 on Reducing and Mediating Gliosis, Immunoinflammatory Response, and Neuronal Cell Death After Traumatic Brain Injury",Neuroscience,"traumatic brain injury, gfap, tlr2, neun, secondary neural cell death, ngp1-01"
"Effects of Mate Separation on Corticosterone and Testosterone Levels in Zebra Finches, Taeniopygia Guttata",Neuroscience,"zebra finch, corticosterone, testosterone, mate separation, pair bond"
The Effects and Implications of Sex Steroid Hormones on Adult Neurogenesis in the Main Olfactory Bulb,Neuroscience; Biology,"Adult, Neurogenesis, Olfaction, Discrimination, Hormones"
Accounts of Brain Disease: Exploring the Cellular Mechanisms of Obsessive Compulsive Disorder and Its Implications in the Framework of Anomalous Monism As a Semantic Theory of Mind,Neuroscience; Philosophy,"neuroscience, ocd, obsessive compulsive disorder, marble burying, cannabinoids, cannabinoid receptors, cb1, anomalous monism"
The Therapeutic Effects of Environmental and Physical Enrichment on Motor Behavior Function in a Rat Model of Parkinson's Disease,Neuroscience; Psychology; Biology,"Neuroscience, Parkinson's Disease, Environmental Enrichment, Physical Enrichment, Exercise, Prevention, Therapy, Cognitive Brain Reserve, Neurogenesis, Plasticity"
"I Think I Can, I Think I Can, I Think I Can: The Role of Affect in Second Language Acquisition: Pienso Que Sí, Pienso Que Sí, Pienso Que Sí: El Papel de la Afición en la Adquisición de una Segunda Lengua",Neuroscience; Spanish,"Neurolinguistics, Psycholingusitics, Affect, Second Language Acquisition, Token Economies"
Radical Absurdity: Reinterpreting Camus For a Better Absurdism,Philosophy,"absurd, camus, absurdism, existentialism"
Can Pure Music Be Meaningful?,Philosophy,"Aesthetics, Philosophy of Music, Expression, Musical Meaning"
"Agrarianism: Red Barns, Happy Cows, and Ignorant Farmers? Or is there More to it?",Philosophy,"agrarianism, sustainability, intrinsic value, instrumental value"
Caring About Stories: A Conceptual Investigation of Narrative Art and Moral Understanding,Philosophy,"applied ethics, aesthetics, narrative, literature"
Ought-Thenticity: A Restructuring of Understanding Why One Should Strive Towards Being An Authentic Human Being,Philosophy,"authenticity, ought, Dasein, Existentialism, Romantic, Contemporary, importance"
Authenticity and Art: Towards a New Conception of Authenticity and its Application to Art,Philosophy,"authenticity, self, art, aesthetics, art evaluation, artist motivation, romanticism, existentialism"
Buddhist 'Emptiness' and the Practice of Nonconceptual Content,Philosophy,"buddhsim, emptiness, comparative philosophy, nagarjuna, mcdowell, concepts"
Necessary Criteria to Save a Dying Practice: An Attempt to Morally Justify Capital Punishment,Philosophy,"capital punishment, death penalty, morality, retribution, deterrent effect"
A Moral Objection to Capitalism Regarding the Treatment of Labor and What an Alternative System Should Aim to Resolve,Philosophy,"Capitalism, Marx, Smith, Friedman, Labor, Capitalist, Alienation, Exploitation, Liberty, Domination, Economic Democracy"
Beyond Etiquette: Connecting to the Value of People,Philosophy,"Cognitivism, Altruism, Care Theory, Value of Persons"
Tough Pill to Swallow: Evaluating Ethical Concerns Regarding 'Cosmetic Psychopharmacology',Philosophy,cosmetic psychopharmacology
"Dexter a Virtuous Vigilante, or Immoral Psychopath: A Deontological and Virtue Ethic Assessment of Showtime’s Series Dexter",Philosophy,"Dexter, morality, deontology, virtue ethics, pop-culture, philosophy"
The Ambiguity of Perception: An Examination and Critique of an Empiricist Perceptual Theory in the Defense of a Realist Theory of Perception,Philosophy,"empiricist, realist, perception"
To Be or Not To Be Selfish: Ethical Egoism and Altruism,Philosophy,"ethical egoism, virtue, altruism, intermediate, Aristotle, Ayn Rand, Ethcial Theory, Self-Interest, Flourish, Flourishing, Virtuous, Happiness, Selfish, Selfishness, Selflessness"
Will to Be Oneself: Does Kierkegaard's Subjective Faith Triumph Over Despair?,Philosophy,"faith, despair, kierkegaard, existentialism"
The Question of the Subject: Diving Headfirst into the Philosophy of Paul Ricoeur,Philosophy,"hermeneutics, phenomenology, paul ricoeur, martin heidegger"
A Moral Justification For Humanitarian Military Intervention,Philosophy,"humanitarian military intervention, john rawls, human rights, applied ethics"
"The Changing of Just War Theory: Understanding how just war theory needs to evolve with modern warfare, changing conceptions, and various ethical systems",Philosophy,Just war theory
The Steady Mind: An Investigation into Stoic and Hindu Notions of Liberation,Philosophy,"Marcus Aurelius, bhagavad gita, stoicism, hinduism, comparative philosophy, east/west"
"Action, Normativity, and Desire: Reflections on Reasons Internalism",Philosophy,"metaethics, ethics"
"Philosophy and its Relationship with the Sciences, and Other Academic Disciplines",Philosophy,metaphilosophy
Perils of Postmodernity: a Philosophical Investigation of Meaning and Narrative,Philosophy,"phenomenology, postmodernism, hermeneutics, self"
Moral Duty As An Escape From Synthetic Inequality,Philosophy,"philosophy, kant, competition, morality, ethics, based"
Meaning Without Proof or Evidence: Vindicating the Language of Religious Belief,Philosophy,"philosophy, language, religion, belief, meaning"
Ain't It The Truth?: Considering the Search for ‘Truth’ of Moral Knowledge as presented in Plato’s “Meno”,Philosophy,"Plato, Meno, Meta-Ethical Theory, Virtue Theory, Pragmatism"
The Tyrant and the Savant: An Examination of Political Legitimacy and Morality,Philosophy,"political legitimacy, morality"
Is Belief in Progress Delusional?: An Investigation of the Notion of Human Progress,Philosophy,"Progress, Delusion, Morality, Human Progress, Epistemology, Philosophy of History, Pragmatism, Hegel, Rousseau, Mackie"
By the Earth's Weight: Land Ownership and Understanding Nature Through Virtue Theory,Philosophy,"property, faulkner, the bear, john locke, aristotle"
Because I Said So,Philosophy,"punishment, threaten, rights"
"Rhetoric, Art, Poetry, Music, and Philosophy: Philosophical Investigations of a Philosorapper",Philosophy,"rap music, philosophy, rhetoric, poetry, music, sartre, rap, hip hop, emotion, pathos, insurrectionist"
The Triumph Over the Unreasonable: a Theory of Political Justice For the New Age,Philosophy,"rawls, burdens of judgment, nussbaum, capabilities approach, overlapping consensus, reasonable pluralism"
"Young, Black, Male, & Poor = Bad? : Exploring Our Society's Concept of Moral Universals Regarding Good and Bad Human Beings",Philosophy,"social conception of right and wrong, stereotypes on the young black male"
"My Bun In Her Oven: Ethics, Exploitation, and Dharma in India's Surrogacy Industry",Philosophy,"Surrogacy, India, Dharma, Hinduism, Pregnancy, Transnational Feminism, Bioethics, Medical Ethics, Exploitation"
"Can Terrorism Be Morally Justified? And If So, When?: Rethinking The Moral Status of Terrorist Violence",Philosophy,"terrorism, ethics, political violence, legitimate authority, killing of innocents, self-defense"
"My Child, Your Child, Our Child? the Nature of Children, Elders, and the Obligation to Educate",Philosophy,"the nature of children, obligation, community"
The Virtual Community: Understanding the Impact of Technology on Human Interaction Through the Work of Albert Borgmann,Philosophy,"virtual community, community, virtual reality, borgmann, physical reality"
Wildness As Reform of Technology,Philosophy,"wildness, focal thing, technology"
The Logical Nexus: Analysis and Application of Wittgenstein's Picture Theory of Language,Philosophy,Wittgenstein
How to Account for and Measure Human Well-Being,Philosophy; Business Economics,"well-being, wellbeing, happiness, philosophy, prudential value, subjective well-being, objective well-being, mental state, preference satisfaction, desire satisfaction, objective list account, regression analysis, multinomial logit"
TOMSfoolery: A Neocolonial Deconstruction of the One For One Ideology of Giving,Philosophy; French and Francophone Studies,"Colonialism, Feminism, Philosophy, global South, global North, Dignity, Development, Resistance, Oppression, Hierarchy, Hegemony, Orientalism"
The Semantics of Goodness: A Study of Prudential Value,Philosophy; French and Francophone Studies,"The good, prudential value, hedonism, desire theory, the capabilities approach, Derrida, Post-Structuralism"
Relativistic Perturbations and Ontological Implications: Exploring the Zitterbewegung and Laying the Groundwork for a Quantum Ontology,Philosophy; Physics,"Quantum, Ontology, Zitterbewegung, Perturbation Theory, Electron, Photon, Bohm, Many Worlds, Copenhagen"
Electrons Aligned and Felines Undefined: Interpretations of Quantum Mechanics and Perturbing the Spin-Orbit Interaction in Electrons,Philosophy; Physics,"quantum, interpretations, perturbation theory, realism, philosophy of science, measurement, superposition, spin-orbit, schrodinger's cat"
Armed with an Easel: Understanding Artistic Political Praxis Through the Works of Theodor Adorno and Chantal Mouffe,Philosophy; Political Science,"Adorno, Mouffe, Political Praxis, Aesthetic Theory, Critical art, negative dialectics, aesthetic negativity, autonomous art, hegemony, culture industry, agonistics, post-Fordism, artistic resistance"
Valuing the Arctic National Wildlife Refuge: A Defense of Countercultural Environmentalism,Philosophy; Political Science,"Arctic National Wildlife Refuge, countercultural environmentalism, bioregionalism, Buddhism, virtue ethics"
Attachment and Emotions in Relation to Ideas and Concepts: A Psychological Study and Philosophical Inquiry,Philosophy; Psychology,"Attachment system, Emotion, Cognitive function, Control systems theory"
Beauty is Experienced: Beautiful Objects and the Promise of Happiness,Philosophy; Psychology,"beauty, object, beautiful, happiness, experience, bento, handaxe"
Forgiveness and Resentment: A Study in Philosophy and Psychology,Philosophy; Psychology,"forgiveness, resentment, psychology, prisoners dilemma, philsophy, emotions, ethics"
My Tattoos Are My Story: An Exploration of the Self and Body Modification,Philosophy; Religious Studies,"Self, Body Modification, Tattoos, Polynesia, Plato, Samkhya, John Stewart Mill, Society, Contemporary, Body, Narrative, Aesthetic"
How Can Theatre Enhance An Understanding of Ethics Perfected By Unconditional Love?,Philosophy; Theatre and Dance,"theatre, philosophy, ethics, unconditional love"
Modeling the Optical Emission Line Profiles of Active Galactic Nuclei: Working Towards a Continuous Optical Classification Scheme Beyond Type 1/Type 2,Physics,"Active Galactic Nuclei, Optical, Decomposition"
Theoretical Resonance Calculations for the Isobaric Analogs 133-Sn and 133-Sb,Physics,"isobars, isobaric analog states, isobaric analog resonaces, Sn132, Sn133, Sb133, Isospin"
Archimedes Drill Propulsion,Physics,"propulsion, Coulomb, helical, angular motion, simulation, flagella, particle concentration, mass density, terminal velocity"
Temperature's  Effects on the Expansion Force of Osorb,Physics,science
Optimization of BEEM Techniques Through the Analysis of GaN Nanowires and Au: GaAs,Physics,"ballistic electron emission microscopy, scanning tunneling microscopy, gan, gaas, gallium nitride, gallium arsenide"
Air Drag and External Ballistics,Physics,"ballistics, external ballistics, air drag"
The Effects of a Magnetic Field on a Conical Bead Pile,Physics,"bead pile, granular material, avalanches, critical behavior"
Establishing Methods to Track Surface Avalanches on a Bead Pile,Physics,"critical, phenomena, bead pile"
Differential Photometry of Transiting Exoplanets,Physics,"exoplanet transit, differential photometry, iraf"
Perturbing Spacetime,Physics,"general relativity, computational physics"
Manipulation of Transverse Photonic Degrees of Freedom Via Classical and Hong-Ou-Mandel Interference,Physics,"hong-ou-mandel interference, photon, transverse spatial wavefunction, laser, mode, interferometer, hong-ou-mandel interference, photon, transverse spatial wavefunction, laser, mode, interferometer"
Sorting Spacial Wavefunctions of Photons by Parity,Physics,"photons, parity, optics, quantum"
The Manipulation of Transverse Spatial Mode and Polarization Degrees of Freedom of Light,Physics,"quantum information, quantum interference, hong ou mandel interference, photons, light, asymmetric mach zehnder interferometer"
The Manipulation of Transverse Spatial Mode and Polarization Degrees of Freedom of Light in an Asymmetric Optical System,Physics,"Quantum Information, Quantum Interference, Hong Ou Mandel Interference, Photons, Light, Asymmetric Mach Zehnder Interferometer"
Progress Toward Using An Optical Tweezer to Make Scattering-Based Size Measurements,Physics,scattering based-size measurements
Liquid Body Armor and Shear Thickening Fluids,Physics,"shear thickening fluid, liquid body armor, oobleck"
Rocket Science Behind the Political Science: Comparing Space Visions of the Presidents From 1993-2011 and the Rocket Technology That Helped Characterize Them,Physics; Political Science,"obama, george w. bush, clinton, rocket science, rocket staging, rocket fuels, nasa, space policy"
Human Rights Organizations As Agents of Change: When Do They Fail and When Do They Succeed?,Political Science,"advocacy, campaigns, experiment, amnesty international, human rights"
Constituents on the Cutting Room Floor: An analysis of the relationship between redistricting processes and malaportionment in the United States House of Representatives,Political Science,"Redistricting, Gerrymandering, Malapportionment, Congress, Institutions"
American Military Strategy and the Offense-Defense Theory,Political Science,"America, military, spending, offense-defense theory, military technology, military doctrine, military strategy"
A Changing American Security Paradigm: The Risk Management Model and American National Security Strategy,Political Science,"American national security strategy, risk management"
The Politics of Anti-Affirmative Action Initiatives: a Comparative Case Study Approach,Political Science,anti-affirmative action
Uncovering the Strategic Logic of Boko Haram,Political Science,"Boko Haram, Religious Terrorism, Political Terrorism, Boko Haram Motivations"
"Business and Political Clout: Reexamining the Relationship Between Government, Private Interests and Public PO",Political Science,"Business, Lobbying, Public Opinion"
Gauging and Explaining the Impact of Campaign Field Offices in the 2012 Presidential Election,Political Science,"Campaigns, Presidential Campaigns, Obama, Romney, McCain, Microtargetting, Field offices, resource allocation"
Clean Air - A Luxury Only the Rich Can Afford? An Analysis of International Environmental Policy Using a Development Framework,Political Science,"carbon emissions, environmental policy, economic development"
Schooled: How Chicago Learned to Apply Civic Capacity to Accomplish Successful School Reform,Political Science,"Chicago, education, school reform, civic capacity"
Portfolio Management Model Strategy Reform: Lessons Through Civic Capacity in Baltimore and New Orleans,Political Science,"civic capacity, portfolio management model, New Orleans, Baltimore, urban education"
Choosing Gods: Constructivism vs. Realism in the Military Interventions in Religious Civil Wars,Political Science,"civil war, realism, constructivism, Lebanon, Cyprus, Sri Lanka, India, China, Israel, Syria, Greece, Turkey"
The Role of Presidential Worldview on United States Counter-Narcotics Policy in Colombia Since 1981,Political Science,"Colombia, drugs, Reagan, Clinton, Bush, Obama, worldview"
Survival or Collapse? Comparing the Legitimacy of the Communist Regimes in China and the Soviet Union During the 1980s,Political Science,"communist regime, legitimacy"
The Clash of Norms: An Examination of Emerging Governance Norms in Cyberspace,Political Science,"Constructivism, Norm Emergence Theory, Antipreneur, Cyberspace, Internet governance"
Does European Union Membership Change Corruption?,Political Science,"corruption, political corruption, Hungary, Serbia, Bosnia-Herzegovina, Kazakhstan, communism, corruption perceptions, European Union"
State vs. Norm: the Impact of Culture on State Internalization of International Norms,Political Science,"culture, norm internalization, defense, international criminal court (icc)"
"Dam Institutions: The Nexus of Anarchy and Interdependence - Dams, Water, and States",Political Science,"dam, water, conflict, cooperation"
Democracy and Political Citizenry: Wolin From Student Revolt to Superpower,Political Science,"democracy, the political, wolin, demos, inverted totalitarianism"
The Institutionalization of Social and Ethnic Divisions in Democratic States,Political Science,"Democracy, Violence, Consociationalism, Political Institutions, Political Violence, Civil Conflict, Protests, Social Movements"
Growing a National Economy: a Comparative Analysis of the Economic Growth in a Country Under Authoritarian or Democratic Rule,Political Science,"economic growth, authoritarian regimes, comparative case study"
Timepiece Teaching: How Rhetoric Molds the World,Political Science,"economic rhetoric, standardized education"
The Impact of U.S. Economic Sanctions on Cuban Inequality,Political Science,"Economic sanctions, Cuba, U.S., Economic inequality"
May it Please the Environment?: A Study of the Role Regional Location Plays in Influencing Federal Court Decisions on Fossil Fuel Cases,Political Science,"environment, judge, environmental law, fossil fuels"
“Forgiving The Unforgivable”: An Exploration of Post-Ethnic Conflict Peacebuilding and The Effects On The Durability of Peace,Political Science,"ethnic conflict, peace, peace studies, war, civil war, peacebuilding, reconciliation, United Nations, peacekeeping, Bosnia, Serb, Bosniak, Israel, Israeli, Palestine, Palestinian, Intifada, Georgia, Abkhazia"
Revolution Has Gone Viral: the Effect of Facebook and Youtube on Social Movement Mobilization Within the Arab Spring,Political Science,"facebook, youtube, arab spring, social movement mobilization, social networking sites, social media sites, framing"
Variation of Female Genital Mutilation Rates Between Egypt and Sierra Leone Examined Through Underlying Root Causes,Political Science,female genital mutilation in egypt and sierra leone
An Analysis of Robert Goodin's Public Utilitarianism in Application to the Current Firearm Debate,Political Science,"Firearms, Utilitarianism, Robert E. Goodin, Regulation"
Aiding Aids: The Motivations of French HIV/AIDS Foreign Aid to African Countries,Political Science,"foreign aid, France, HIV, AIDS"
Assessing Chinese Soft Power In Africa Through UN General Assembly Votes,Political Science,"foreign aid, soft power, power, Africa, China, Nigeria, Kenya, Egypt, United Nations, general assembly, UN"
The Continuity of United States Counter Terrorism Policy: An Analysis of the Impact of Bureaucratic Leadership Dynamics on Policy Decisions,Political Science,"foreign policy decision making, foreign policy analysis, international relations, counterterrorism, drones, bureaucratic politics model"
Dimensions of Liberation: Transcending Advanced Industrial Society,Political Science,"frankfurt school, critical theory, new left, herbert marcuse, max horkheimer, tolerance"
Keepin' the 'Hood Intact: Using Civic Capacity to Study and Prevent Displacement in Redeveloping Neighborhoods,Political Science,"gentrification, redevelopment, civic capacity"
Going Green: Assessing the Strategies Sustainability Organizations Use For Mobilizing the Grassroots,Political Science,"grassroots, sustainability, mobilization, environment"
"The Effectiveness of the Strategies Interest Groups Use to Influence Health Care Reform in The United States: A Case Study Analysis of President Clinton, Bush, and Obama's Health Care Reforms",Political Science,"health care reform, health care, interest groups, lobbying"
Neglected Human Rights: Examining the Causes of Socio-Economic Rights Violations Within the Occupied Palestinian Territories,Political Science,"human rights, socio-ecomomic human rights, israeli-palestinian conflict"
The Land of Immigrants?:  the Role of Nationalism in the American Public in the Creation of Restrictive Immigration Policies in the United States From the 1920s to the 2000s,Political Science,immigration
The Balance of Power Has Shifted: How Affluent Interest Groups are Contributing to Income Inequality in the United States,Political Science,"income inequality, power, interest groups, public policy, taxes"
Judgment and Justices: Judicial Philosophy and Modalities of Constitutional Argument,Political Science,"judicial philosophy, scalia, rehnquist, modalities of constitutional argument"
